{
  "schema_version": 1,
  "candidate_version": "0.8.2",
  "parent_version": "0.8.1",
  "source_revision": "git:5da90f2ec08111386045c3b26c5e8badce053f7b+working-tree-candidate-patch (uncommitted four-file patch on top of HEAD; working tree also carries pre-existing parallel-session work — SKILL.md document-chain section, untracked document-chain.md and docs/product/, plus tracked AGENTS.md +14-line document-chain linter section and untracked tools/lab/doc_chain.py (2026-09-20 ~12:00, concurrent session, zero overlap with the four candidate files and this bug's gap surfaces; AGENTS.md/tools/lab are not protected paths) — which is NOT part of this candidate; digest excludes .zcode symlink, .agentflow-records.sqlite3, .DS_Store, command-code-session-*.html)",
  "artifact_digest": "sha256:e40d281cb2a8f6186405148a318ca9372c0fb9910f26d747a94be340e93e85e0",
  "hypothesis": "Naming the branch-integration/conflict-resolution task shape in the skill trigger surface (frontmatter description), adding the post-merge deterministic-check discipline with the conflict-marker-grep anti-pattern and the no-silent-waiver ruling to the Integrate step, a routing-table row (with zh mirror), and an authorization-vs-verification sentence on hard boundary 3 makes merge/conflict-resolution tasks enter the material-change review gate with raw deterministic-check output before completion, instead of sliding past every gate as 'git operations'.",
  "evidence_ids": ["ISS-2026-026"],
  "changed_components": [
    "skills/agentflow/SKILL.md",
    "skills/agentflow/references/roles.md",
    "skills/agentflow/references/contracts.md",
    "docs/agent-roles.md"
  ],
  "risk_class": "low",
  "evaluation_suite_revision": "git:5da90f2ec08111386045c3b26c5e8badce053f7b:evals/public (declared, not run — no instrumented merge/integration case exists in the public or business suite)",
  "primary_metrics": ["merge_integration_gate_trigger_rate", "first_pass_review_rate"],
  "guardrails": ["permission_violations", "escaped_defects", "tool_failures"],
  "rejection_criteria": [
    "Any guardrail increases.",
    "Any protected slice regresses.",
    "No instrumented business case exists for merge/integration behavior: the release must state measurement: none (method-level change, no instrumented business task) and must not describe the candidate as a verified improvement."
  ],
  "protected_slices": ["role-selection", "architecture-and-safety", "artifact-verification"]
}
