{
  "schema_version": 1,
  "candidate_version": "0.8.6",
  "parent_version": "0.8.5",
  "source_revision": "git:e32ef14 + uncommitted candidate (working tree at evaluation time: 0.8.5 ui-track delta + 0.8.6 expression-scope delta)",
  "hypothesis": "【parent 注】0.8.5（ui 轨候选）已评估完毕待同一发布门批准；本候选 delta 叠加其上，四文件与 0.8.5 改动面不重叠（document-chain.md 仅条款区，ui 轨节未动）。【digest 注】artifact_digest 覆盖候选树副本（未提交工作树），排除 .zcode 符号链接目录与 .agentflow-records.sqlite3。主体假设：表达纪律三件套（document-chain.md 条款、模板写前提醒、doc_chain.py C12/C13）与 reviewer 文档模式全部锚定文档链，会话交付给用户的独立书面产物（分析报告/状态汇报）零覆盖——用户 2026-09-22 九组黑话反馈中两组是条款未点名的新形态：代号一次定义后裸用作正文持续主语（A 桶/D 桶/G 桶）、数据库模式词直搬散文主语（prepared 会话/Run）。修复 = 条款增两条形态规则 + 作用域显式扩展到会话交付物（配 supervisor 写前自查职责与 reviewer 指派路径两个可达面）+ doc_chain.py 新增 C14 代号裸用与 --file 单文件机器检查入口。评测口径：self-test 26→38 全绿不回归；validate.py all 9 项 PASS；unittest 155 OK；isolation blocked=[]；真实缺陷语料（aiwork 两份分析报告）--file 检测——AIPPT 报告 C14 命中>0（期望捕获代号裸用形态）、姊妹报告与 Youc『IP 桶』文件零误报（precision 护栏）；基线无 --file 入口故两项语料 case 记 not-measurable（accepted=false）。method-level change; evals/business 切片不覆盖会话交付物分析报告面——release record 须记 measurement: none (method-level change, no instrumented business task)",
  "evidence_ids": [
    "EP-20260922-002"
  ],
  "changed_components": [
    "skills/agentflow/references/document-chain.md",
    "skills/agentflow/references/roles.md",
    "agents/reviewer.md",
    "tools/lab/doc_chain.py"
  ],
  "risk_class": "low",
  "evaluation_suite_revision": "git:<working-tree>:tools/lab/doc_chain.py --self-test (38 cases) + validate.py all + unittest discover + --file corpus lint (aiwork analysis reports, outside-repo fixtures)",
  "primary_metrics": [
    "doc_chain_self_test_pass (38/38, 基线 26/26 行为不回归)",
    "defect_corpus_detection (--file 对 AIPPT 报告 C14 命中 4 处 :40/:274/:280/:648; 基线无该能力)",
    "corpus_precision_guard (姊妹报告 + Youc IP 桶文件 0 finding)",
    "expression_scope_text_present (条款形态规则+作用域声明、roles.md 职责、reviewer.md 检查项由独立 evaluator 内容核对)"
  ],
  "guardrails": [
    "validate.py all 全绿（schemas/examples/evals/artifacts/mock/protected/manifests/docs/tests）",
    "isolation.py check-diff blocked=[]",
    "既有 C1-C13 自测 case 不回归（26 个原 case 全部保留）",
    "C12/C13 finding 字符串与行为逐字不变（重构进共享函数但语义零变更）",
    "C14 无真实语料误报（组/档形态不收的宽度决策由正反例自测钉死）"
  ],
  "rejection_criteria": [
    "任一 guardrail 失败",
    "C14 在干净语料或真实业务仓文件上出现误报",
    "作用域声明或任一形态规则缺失（evaluator 内容核对不过）",
    "既有 26 case 或 155 单测出现新失败"
  ],
  "protected_slices": [
    "role-selection",
    "architecture-and-safety",
    "artifact-verification"
  ],
  "artifact_digest": "sha256:4713e1a2050805d1aae9322c2ad04b30a9c6bef73fcd2cb9aaa8f80d55148121"
}
