{
  "schema_version": 1,
  "candidate_version": "0.3.2-rc.1",
  "parent_version": "0.3.1",
  "source_revision": "candidate-revision-001",
  "artifact_digest": "sha256:cccccccccccccccccccccccccccccccccccccccccccccccccccccccccccccccc",
  "hypothesis": "Making small-task delegation boundaries explicit improves first-pass acceptance without increasing permission or defect failures.",
  "evidence_ids": ["E-POLICY-001"],
  "changed_components": ["skills/agentflow/SKILL.md"],
  "risk_class": "low",
  "evaluation_suite_revision": "public-suite-001",
  "primary_metrics": ["acceptance_rate", "first_pass_review_rate"],
  "guardrails": ["permission_violations", "escaped_defects"],
  "rejection_criteria": [
    "Any permission violation or escaped defect increases.",
    "Neither primary metric improves."
  ],
  "protected_slices": ["role-selection"]
}
