{
  "schema_version": 1,
  "candidate_version": "0.8.4",
  "parent_version": "0.8.3",
  "source_revision": "git:7a235b5 + uncommitted candidate (working tree at evaluation time)",
  "artifact_digest": "sha256:7b68f5bd3faa93f792d3b8446b79d38b1951d84a61a181d9a5accec4d1a6b7c1",
  "hypothesis": "文档链四类复发/漏检缺陷（时效性引用无收口、流程角色词经 brief 注入、方法条款与目标仓模板冲突无裁决、机器门存在性≠形态标准）根因是装置缺口而非执行疏忽；在 document-chain.md 加 4 项条款（收口通读门/brief 卫生+角色词入术语纪律/冲突裁决质量条款优先/存在性≠形态）、修模板自相矛盾（fe §1.4.1 逐行裁决列）、linter 加 C12/C13 两检查后：C12/C13 在真实缺陷语料上精确命中且在判别性自测（24/24）与全仓校验上零回归。 评测口径：C12 修型后对已知语料 5 行位/7 条全命中（4 原始实例+1 同型新增真阳性 design/qa:598），C13=19；self-test 26/26。method-level change; evals/business 切片不可用（U-01..03 未解除，且其测量面是文档审查行为、不覆盖生成侧 linter/条款改动）——release record 须记 measurement: none (method-level change, no instrumented business task)",
  "evidence_ids": [
    "EP-20260921-001",
    "BUG-20260921-01",
    "BUG-20260921-02",
    "BUG-20260921-03",
    "BUG-20260921-04",
    "BUG-20260921-05"
  ],
  "changed_components": [
    "skills/agentflow/references/document-chain.md",
    "skills/agentflow/references/document-chain-templates.md",
    "agents/reviewer.md",
    "tools/lab/doc_chain.py"
  ],
  "risk_class": "low",
  "evaluation_suite_revision": "git:7a235b5:tools/lab/doc_chain.py --self-test (26 cases) + baseline-vs-candidate on real defect corpus (aiwork feature-2026-09-18-定时任务 chain)",
  "primary_metrics": [
    "doc_chain_self_test_pass (26/26, 含 C12 反引号形态正反例)",
    "candidate_linter_hits_on_known_defect_corpus (C12=7 findings/5 行位：4 原始实例+design/qa:598 同型真阳性; C13=19; 基线=0 命中)",
    "candidate_linter_zero_new_findings_on_clean_fixtures"
  ],
  "guardrails": [
    "validate.py all 全绿（schemas/examples/evals/artifacts/mock/protected/manifests/docs/tests）",
    "isolation.py check-diff blocked=[]",
    "既有 C1-C11 自测 case 不回归"
  ],
  "rejection_criteria": [
    "任一 guardrail 失败",
    "C12/C13 在好例 fixture 上误报",
    "C12/C13 在已知缺陷语料上漏报（命中数 < 基线人工确认清单）"
  ],
  "protected_slices": [
    "role-selection",
    "architecture-and-safety",
    "artifact-verification"
  ]
}