{
  "schema_version": 1,
  "candidate_version": "0.8.5",
  "parent_version": "0.8.4",
  "source_revision": "git:e32ef14 + uncommitted candidate (working tree at evaluation time)",
  "hypothesis": "文档链对有独立设计流的目标仓（设计稿评审/品牌规范/多站点约定）缺 ui 轨支撑——UI 需求与视觉口径散落在 spec/fe 与会话纪律里，是 0.8.2 前文档链「存在但质量靠会话自觉」的同型缺口在 ui 维度的再现；在 document-chain-templates.md 增 spec/ui 与 design/ui 骨架（与 spec/fe、design/be|fe 家族同构：§0 反审 checklist、固定节标题、真源声明引用不复制、变更记录承载用户迭代）、document-chain.md 声明 ui 轨启用规则（proposal 保持单一、linter 只做存在性/围栏/时效性检查、形态质量靠反审+README 门禁兜底）后：目标仓可按固定骨架产出 ui 轨第一版并支持用户迭代，且不回归既有 linter/自测/全仓校验。评测口径：Youc 试点（feature-2026-09-19-office-agent）作为消费方在候选工具下 linter PASS；self-test 26/26 与 validate.py all 9 项 PASS 零回归；ui 骨架存在性与三要素同构由独立 evaluator 对照检查确认。method-level change; evals/business 切片不覆盖 ui 轨生成面——release record 须记 measurement: none (method-level change, no instrumented business task)",
  "evidence_ids": [
    "EP-20260922-001"
  ],
  "changed_components": [
    "skills/agentflow/references/document-chain.md",
    "skills/agentflow/references/document-chain-templates.md"
  ],
  "risk_class": "low",
  "evaluation_suite_revision": "git:e32ef14:tools/lab/doc_chain.py --self-test (26 cases) + validate.py all + consumer pilot lint (Youc docs/features/feature-2026-09-19-office-agent)",
  "primary_metrics": [
    "doc_chain_self_test_pass (26/26, 基线行为不回归)",
    "consumer_pilot_lint_pass (Youc 试点目录 PASS，含 ui 轨文件被 C1/C3/C10/C12/C13 扫描)",
    "ui_skeleton_coverage (candidate: spec/ui + design/ui 两节存在且含 §0 反审/自检/真源三要素; baseline: 0 节)"
  ],
  "guardrails": [
    "validate.py all 全绿（schemas/examples/evals/artifacts/mock/protected/manifests/docs/tests）",
    "isolation.py check-diff blocked=[]",
    "既有 C1-C13 自测 case 不回归（26/26）",
    "proposal 单一不分角色原则不被 ui 轨稀释（evaluator 第 7 项核实）"
  ],
  "rejection_criteria": [
    "任一 guardrail 失败",
    "ui 骨架与既有模板家族不同构（缺 §0 反审或真源声明）",
    "linter 在既有 26 case 上出现新失败"
  ],
  "protected_slices": [
    "role-selection",
    "architecture-and-safety",
    "artifact-verification"
  ],
  "artifact_digest": "sha256:e3edae0c49eee66dfa81354f914b08b27376d74dab0ca891b1a72ba90ebe39f0"
}